,company,company_url,job_title,job_url,job_id,location,work_type,salary,posted_at,is_easy_apply,applicant_count,description,apply_url,posted_ago
3,Largeton Group,https://www.linkedin.com/company/largeton-inc/life,Snowflake Data Engineer,https://www.linkedin.com/jobs/view/4260899485,4260899485,"Miami, FL",On-site,,2025-07-02 18:17:12,True,62 applicants,"Lead the design, architecture, and development of scalable data solutions on the Snowflake platform. Provide technical leadership and mentorship to junior data engineers, ensuring adherence to best practices. Develop, implement, and optimize efficient ETL/ELT processes using Snowflake and third-party tools. Optimize and tune Snowflake warehouses, queries, and data ingestion processes for high performance. Establish and enforce robust data governance, security, and compliance standards. Automate and orchestrate data pipelines, leveraging features of Snowflake and Azure. Collaborate with cross-functional teams (data architects, scientists, analysts) to align infrastructure with business needs. Stay current with Snowflake features, best practices, and introduce innovative technologies or methodologies. Lead cloud integration and management efforts for Snowflake deployments on Azure. Maintain comprehensive technical documentation for data architecture, pipelines, and processes. Leverage deep expertise in Snowflake features (Snowpipe, Streams, Tasks, Materialized Views, Data Sharing, etc.). Extract and ingest data from APIs, ensuring high data quality and adherence to best practices. Apply advanced data modeling and warehousing concepts (star/snowflake schemas). Demonstrate advanced SQL proficiency for query optimization and troubleshooting. Utilize ETL/ELT tools (FiveTran, Matillion, Talend, Informatica) for data integration. Implement scripting and automation (Python, Bash) for data processes and CI/CD integration. Develop and tune machine learning models within Azure and Snowflake environments. Ensure compliance with data security standards (GDPR, HIPAA, SOC 2) and practices. Work within Agile development environments and adapt to fast-paced, iterative workflows.",https://www.linkedin.com/jobs/view/4260899485,5
1,Jobright.ai,https://www.linkedin.com/company/jobright-ai/life,"Data Analytics Engineer, New Grad & Entry Level",https://www.linkedin.com/jobs/view/4259550903,4259550903,United States,Remote,,2025-07-02 16:25:16,False,,"Who we areAdelaide is the leader in one of the fastest-growing areas of digital advertising: attention metrics. Since 2020, we’ve been a trusted measurement partner for 40% of Fortune 50 companies. They rely on our metric, AU, to maximize the effectiveness of media spend. AU is “the attention economy's most widely recognized metric,” according to Adweek, and we swept the measurement category in the 2024 Adexchanger awards.
Position OverviewThis position reports to the Senior Data Analytics Engineer; it will behave cross functionally across Data teams with an emphasis on supporting the Analytics team and their workflows.In this role, you will be joining a team of data scientists and engineers. You'll help build and maintain the semantic layer of our data pipeline, ensuring clean, consistent, and reusable data models. Day-to-day activities range from developing and testing data models, editing LookML, managing a data catalog, automating data analysis workflows, and working closely with stakeholders to understand and support their data needs.
What you'll learnAn important part of our culture is continuing education and the sharing of ideas. We offer:A large network of investors and advisors for you to access that will help your team succeedMentorship from executives with decades of experience in adtech and mediaRegular internal knowledge-sharing sessionsEducation budget to accelerate your team’s development
Core responsibilities:Assist in building, testing, and maintaining transformational data models (dbt, Redshift)Help create and manage a clean, reliable reporting layer in Looker using LookMLWork cross-functionally with emphasized support to the Analytics TeamHelp identify and automate manual data analysis processes (Python, dbt)Contribute to maintaining a well-organized data catalog with accurate, accessible metadata for both technical and non-technical audiencesEnsure metric consistency across dashboards and data toolsCollaborate with analysts and PMs to document key metrics and definitionsMonitor adoption and identify opportunities for improved data usability
What you'll bring:SQL Proficiency – Strong ability to write, optimize, and debug SQL queries. You also understand data modeling and warehouse best practices, and you’re committed to writing clean, readable, and well-documented code.BI & Visualization Tools – Hands-on experience with BI/dashboarding platforms (e.g., Looker, Tableau).Data Modeling Tools – Familiarity with semantic modeling tools (e.g., LookML) and dbt; understanding of ETL concepts. Experience with orchestration tools (e.g., Airflow) is a plus.Data Quality & Testing – Strong attention to detail in building data validation, profiling routines, and root cause analysis workflows.Programming Skills – Experience with Python for data transformation, scripting, and automation; experience with associated libraries (e.g., pandas, openpyxl) is a plus.Communication & Collaboration – Excellent interpersonal skills with experience working cross-functionally; ability to translate technical concepts for non-technical audiences and deliver training/support.Educational Background & Experience – Bachelor’s degree in a quantitative, technical, or analytical field (e.g., Computer Science, Math, Physics, Engineering) or a rigorous coding bootcamp with a portfolio demonstrating the above skills.",https://jobright.ai/jobs/info/6859f854d3b885d69bbfe235?utm_source=1124&utm_campaign=6859f854d3b885d69bbfe235&tob=true,5
24,Centraprise,https://www.linkedin.com/company/centraprise/life,Data Engineer (Full time role),https://www.linkedin.com/jobs/view/4259547968,4259547968,"Jersey City, NJ",Hybrid,,2025-07-02 15:57:21,True,over 100 applicants,"Advanced Python programming skills with APIs. Expertise in App design and solutioning. Exp in designing and Implementing Kafka producers and consumers.Experience with Mongo collections, caching technologies like Hazel cast and performance tuning.Deep Development experience in backend data engineering and custom data warehouse applications.Experience in building ETL Pipelines using PySpark or Data Factory. DW experience in MS SQL Server/Oracle/Sybase/Snowflake etc.Knowledge on CI/CD, AKS, Cloud Services,Azure/DBT experience is a plus",https://www.linkedin.com/jobs/view/4259547968,5
25,Gensyn,https://www.linkedin.com/company/gensynai/life,Systems Engineer,https://www.linkedin.com/jobs/view/4259582332,4259582332,United States,Remote,,2025-07-02 19:45:30,False,,"Machine intelligence will soon take over humanity’s role in knowledge-keeping and creation. What started in the mid-1990s as the gradual off-loading of knowledge and decision making to search engines will be rapidly replaced by vast neural networks - with all knowledge compressed into their artificial neurons. Unlike organic life, machine intelligence, built within silicon, needs protocols to coordinate and grow. And, like nature, these protocols should be open, permissionless, and neutral. Starting with compute hardware, the Gensyn protocol networks together the core resources required for machine intelligence to flourish alongside human intelligence.

The Role

Build the software components that make the Gensyn network solve complex distributed machine learning problems

Responsibilities

Contribute to and maintain the Gensyn executor, mesh network, and SDK, adding new features, optimizing existing solutions, fixing bugs, and participating in the architectural evolution of the systemContribute to system architecture and design decisions for large-scale deploymentsConduct code and design reviews to uphold high standards of code quality across the teamMeasure and optimize existing components to ensure they meet end-user requirements effectively

Competencies

Must Have

Rock solid computer science fundamentalsDemonstrable production experience shipping codeProficient in one system-level language (e.g. C/C++, Rust, Go, Zig, …)Deep understanding of distributed systems or systems at scaleOperating system fundamentals - preferably Linux/macOSHighly self-motivated with excellent verbal and written communication skills

Preferred

Experience with common networking protocolsExperience working in high-growth start/scale-up environmentsExperience working with observability tools, such as metrics and tracesExperience with building distributed databases, file systems, or queuesExperience with UNIX/POSIX APIs

Nice to have

Experience with AI systems in productionExperience contributing to or maintaining open-source distributed systemsPerformance optimization tooling and tactics experienceProficient understanding of distributed systems concepts (Consensus, CAP, Fault Tolerance)Proficient in Rust

Compensation / Benefits

Competitive salary + share of equity and token poolFully remote work - we currently hire between the West Coast (PT) and Central Europe (CET) time zonesVisa sponsorship - available for those who would like to relocate to the US after being hired3-4x all expenses paid company retreats around the world, per yearWhatever equipment you needPaid sick leave and flexible vacationCompany-sponsored health, vision, and dental insurance - including spouse/dependents [🇺🇸 only]

Our Principles

Autonomy & Independence

Don’t ask for permission - we have a constraint culture, not a permission culture.Claim ownership of any work stream and set its goals/deadlines, rather than waiting to be assigned work or relying on job specs.Push & pull context on your work rather than waiting for information from others and assuming people know what you’re doing.Communicate to be understood rather than pushing out information and expecting others to work to understand it.Stay a small team - misalignment and politics scale super-linearly with team size. Small protocol teams rival much larger traditional teams.

Rejection of mediocrity & high performance

Give direct feedback to everyone immediately - rather than avoiding unpopularity, expecting things to improve naturally, or trading short-term pain for extreme long-term pain.Embrace an extreme learning rate - rather than assuming limits to your ability / knowledge.Don’t quit - push to the final outcome, despite any barriers.Be anti-fragile - balance short-term risk for long-term outcomes.Reject waste - guard the company’s time, rather than wasting it in meetings without clear purpose/focus, or bikeshedding.Build and design thinly.",https://job-boards.eu.greenhouse.io/gensyn/jobs/4465952101?gh_src=2b6c1912teu,5
16,TekDoors Inc.,https://www.linkedin.com/company/tekdoors/life,GCP Data Engineer,https://www.linkedin.com/jobs/view/4259564507,4259564507,"Phoenix, AZ",On-site,,2025-07-02 18:28:44,True,76 applicants,"Job Title: GCP Data EngineerLocation: Phoenix, AZContract Type: 12 MonthsContract, W2 Must Have:• 6–8 years of hands-on experience in data engineering roles.
Strong expertise with GCP services, specifically:• Dataproc• BigQuery• SQL• Pub/Sub• Airflow• Advanced proficiency in Python programming.• Experience designing and maintaining scalable data pipelines on cloud platforms.• Excellent problem-solving and analytical skills.",https://www.linkedin.com/jobs/view/4259564507,5
99,TalentAlly,https://www.linkedin.com/company/talentallyatwork/life,Data Engineer,https://www.linkedin.com/jobs/view/4260889367,4260889367,"Salisbury, MD",Hybrid,,2025-07-02 16:24:02,False,,"Senior Data Engineer

Do you love building and pioneering in the technology space? Do you enjoy solving complex business problems in a fast-paced, collaborative, inclusive, and iterative delivery environment? At Capital One, you'll be part of a big group of makers, breakers, doers and disruptors, who solve real problems and meet real customer needs. We are seeking Data Engineers who are passionate about marrying data with emerging technologies. As a Capital One Data Engineer, you'll have the opportunity to be on the forefront of driving a major transformation within Capital One.
What You'll Do:Collaborate with and across Agile teams to design, develop, test, implement, and support technical solutions in full-stack development tools and technologiesWork with a team of developers with deep experience in machine learning, distributed microservices, and full stack systemsUtilize programming languages like Java, Scala, Python and Open Source RDBMS and NoSQL databases and Cloud based data warehousing services such as Redshift and SnowflakeShare your passion for staying on top of tech trends, experimenting with and learning new technologies, participating in internal & external technology communities, and mentoring other members of the engineering communityCollaborate with digital product managers, and deliver robust cloud-based solutions that drive powerful experiences to help millions of Americans achieve financial empowermentPerform unit tests and conduct reviews with other team members to make sure your code is rigorously designed, elegantly coded, and effectively tuned for performance
Basic Qualifications:Bachelor's DegreeAt least 3 years of experience in application development (Internship experience does not apply)At least 1 year of experience in big data technologies
Preferred Qualifications:5+ years of experience in application development including Python, SQL, Scala, or Java2+ years of experience with a public cloud (AWS, Microsoft Azure, Google Cloud)3+ years experience with Distributed data/computing tools (MapReduce, Hadoop, Hive, EMR, Kafka, Spark, Gurobi, or MySQL)2+ year experience working on real-time data and streaming applications2+ years of experience with NoSQL implementation (Mongo, Cassandra)2+ years of data warehousing experience (Redshift or Snowflake)3+ years of experience with UNIX/Linux including basic commands and shell scripting2+ years of experience with Agile engineering practices
At this time, Capital One will not sponsor a new applicant for employment authorization, or offer any immigration related support for this position (i.e. H1B, F-1 OPT, F-1 STEM OPT, F-1 CPT, J-1, TN, or another type of work authorization).
The minimum and maximum full-time annual salaries for this role are listed below, by location. Please note that this salary information is solely for candidates hired to perform work within one of these locations, and refers to the amount Capital One is willing to pay at the time of this posting. Salaries for part-time roles will be prorated based upon the agreed upon number of hours to be regularly worked.
McLean, VA: $158,600 - $181,000 for Senior Data Engineer
Richmond, VA: $144,200 - $164,600 for Senior Data Engineer









Candidates hired to work in other locations will be subject to the pay range associated with that location, and the actual annualized salary amount offered to any candidate at the time of hire will be reflected solely in the candidate's offer letter.
This role is also eligible to earn performance based incentive compensation, which may include cash bonus(es) and/or long term incentives (LTI). Incentives could be discretionary or non discretionary depending on the plan.
Capital One offers a comprehensive, competitive, and inclusive set of health, financial and other benefits that support your total well-being. Learn more at theCapital One Careers website. Eligibility varies based on full or part-time status, exempt or non-exempt status, and management level.
This role is expected to accept applications for a minimum of 5 business days.

No agencies please. Capital One is an equal opportunity employer (EOE, including disability/vet) committed to non-discrimination in compliance with applicable federal, state, and local laws. Capital One promotes a drug-free workplace. Capital One will consider for employment qualified applicants with a criminal history in a manner consistent with the requirements of applicable laws regarding criminal background inquiries, including, to the extent applicable, Article 23-A of the New York Correction Law; San Francisco, California Police Code Article 49, Sections 4901-4920; New York City's Fair Chance Act; Philadelphia's Fair Criminal Records Screening Act; and other applicable federal, state, and local laws and regulations regarding criminal background inquiries.

If you have visited our website in search of information on employment opportunities or to apply for a position, and you require an accommodation, please contact Capital One Recruiting at 1-800-304-9102 or via email at RecruitingAccommodation@capitalone.com. All information you provide will be kept confidential and will be used only to the extent required to provide needed reasonable accommodations.
For technical support or questions about Capital One's recruiting process, please send an email to Careers@capitalone.com
Capital One does not provide, endorse nor guarantee and is not liable for third-party products, services, educational tools or other information available through this site.
Capital One Financial is made up of several different entities. Please note that any position posted in Canada is for Capital One Canada, any position posted in the United Kingdom is for Capital One Europe and any position posted in the Philippines is for Capital One Philippines Service Corp. (COPSSC).PDN-9f46bd6a-6f81-46ac-839a-3f809a899d7b",https://tracking.prodivnet.com/track/apply/9f46bd6a-6f81-46ac-839a-3f809a899d7b,5
31,Rose International,https://www.linkedin.com/company/rose-international/life,Database Architect- Center for Data Analytics,https://www.linkedin.com/jobs/view/4261007902,4261007902,"Austin, TX",Hybrid,$95/hr - $107.80/hr,2025-07-02 19:11:37,True,3 applicants,"Date Posted: 07/02/2025Hiring Organization: Rose InternationalPosition Number: 484967Industry: GovernmentJob Title: Database Architect- Center for Data AnalyticsJob Location: Austin, TX, USA, 78751Work Model: HybridWork Model Details: 3 days on-site, 2 days remoteShift: M-f, 8-5Employment Type: TemporaryFT/PT: Full-TimeEstimated Duration (In months): 13Min Hourly Rate($): 95.00Max Hourly Rate($): 107.80Must Have Skills/Attributes: AWS, Azure, Big Data, CCDA, Data Architecture, Data Modeling, Data Warehouse, Java, Python, SQLExperience Desired: Data architecture, data modeling, and data warehousing (10+ yrs); Data architecture, data modeling, and data warehousing (10+ yrs); Ccloud platforms (Azure, AWS, or GCP) (10+ yrs); Cloud-based applications and data storage. (10+ yrs)Preferred Certifications/Licenses: TOGAF, Azure/AWS/GCP Cloud Solution Architect Job Description***Candidates must already reside in the Austin, TX area***
Minimum Requirements:• 10+ years of experience in data architecture, data modeling, and data warehousing.• 10+ years of experience with business intelligence and big data solutions.• 10+ years of experience with cloud platforms (Azure, AWS, or GCP).• 10+ years of experience in developing, deploying, and managing cloud-based applications and data storage.• Strong proficiency in SQL and other database technologies.• Deep understanding of data architecture principles and best practices.• Proven leadership in managing advanced analytics projects.• Experience with healthcare data standards (FHIR, CCDA, HL-7).• Proficiency in ETL tools, data integration platforms, and APIs.• Strong communication skills for both technical and non-technical audiences.• Experience with EHR integration and real-time data streaming.• Knowledge of accessibility standards for user interfaces and reporting tools.
Preferred Experience:• 8+ years of experience implementing and deploying big data applications.• Hands-on expertise in Python and/or Java/Scala.• Experience with hybrid cloud deployments and on-premise-to-cloud migration strategies.• Healthcare industry experience.• Understanding of Information Management principles, IT processes, and SDLC.• Strong consulting and facilitation skills.• Customer-focused communication across all organizational levels.• Proactive leadership style with strong attention to detail.• Certifications such as TOGAF, Azure/AWS/GCP Cloud Solution Architect.
The Senior Data Architect & Analytics Lead will play a critical role in shaping the data infrastructure and analytics strategy for the Texas Health and Human Services Commission (HHSC) Center for Data Analytics (CDA). This role is ideal for a seasoned professional with deep expertise in data architecture, cloud platforms, and advanced analytics, particularly within the healthcare domain. You will be responsible for designing and implementing scalable data structures, leading analytics initiatives, and ensuring data governance and accessibility standards are met. This position requires strong leadership, technical proficiency, and the ability to collaborate across multidisciplinary teams to drive data-driven decision-making.
Key Responsibilities:• Design and build relational databases, data warehouses, and multidimensional databases.• Develop strategies for data acquisition, archival, recovery, and implementation.• Clean and maintain databases, ensuring data integrity and performance.• Lead the design and modeling of cloud-based data architecture solutions using platforms like Snowflake.• Architect and manage ETL pipelines using tools such as Informatica.• Integrate and evaluate emerging technologies including AI, machine learning, and big data analytics.• Ensure compliance with EIR Accessibility standards and assistive technologies.• Maintain centralized metadata registries and enforce enterprise data standards.• Collaborate with cross-functional teams to align data strategies with organizational goals.• Lead analytics projects and provide insights to support strategic decision-making.• Support EHR integration, real-time streaming, and API-based data exchange.
**Only those lawfully authorized to work in the designated country associated with the position will be considered.**
**Please note that all Position start dates and duration are estimates and may be reduced or lengthened based upon a client’s business needs and requirements.**
 Benefits:For information and details on employment benefits offered with this position, please visit here. Should you have any questions/concerns, please contact our HR Department via our secure website.California Pay Equity:For information and details on pay equity laws in California, please visit the State of California Department of Industrial Relations' website here.Rose International is an Equal Opportunity Employer. All qualified applicants will receive consideration for employment without regard to race, color, religion, age, sex, sexual orientation, gender (expression or identity), national origin, arrest and conviction records, disability, veteran status or any other characteristic protected by law. Positions located in San Francisco and Los Angeles, California will be administered in accordance with their respective Fair Chance Ordinances.If you need assistance in completing this application, or during any phase of the application, interview, hiring, or employment process, whether due to a disability or otherwise, please contact our HR Department.Rose International has an official agreement (ID #132522), effective June 30, 2008, with the U.S. Department of Homeland Security, U.S. Citizenship and Immigration Services, Employment Verification Program (E-Verify). (Posting required by OCGA 13/10-91.).",https://www.linkedin.com/jobs/view/4261007902,5
