,company,company_url,job_title,job_url,job_id,location,work_type,salary,posted_at,is_easy_apply,applicant_count,description,apply_url,posted_ago
54,PwC,https://www.linkedin.com/company/pwc/life,Data Engineer- Manager,https://www.linkedin.com/jobs/view/4259198292,4259198292,"California, United States",Hybrid,$99K/yr - $232K/yr,2025-07-02 13:53:26,False,,"Specialty/Competency: Data, Analytics & AI

Industry/Sector: EUR X-Sector

Time Type: Full time

Travel Requirements: Up to 80%

At PwC, our people in data and analytics engineering focus on leveraging advanced technologies and techniques to design and develop robust data solutions for clients. They play a crucial role in transforming raw data into actionable insights, enabling informed decision-making and driving business growth. In data engineering at PwC, you will focus on designing and building data infrastructure and systems to enable efficient data processing and analysis. You will be responsible for developing and implementing data pipelines, data integration, and data transformation solutions.

Enhancing your leadership style, you motivate, develop and inspire others to deliver quality. You are responsible for coaching, leveraging team member’s unique strengths, and managing performance to deliver on client expectations. With your growing knowledge of how business works, you play an important role in identifying opportunities that contribute to the success of our Firm. You are expected to lead with integrity and authenticity, articulating our purpose and values in a meaningful way. You embrace technology and innovation to enhance your delivery and encourage others to do the same.

Skills

Examples of the skills, knowledge, and experiences you need to lead and deliver value at this level include but are not limited to:

Analyse and identify the linkages and interactions between the component parts of an entire system.Take ownership of projects, ensuring their successful planning, budgeting, execution, and completion.Partner with team leadership to ensure collective ownership of quality, timelines, and deliverables.Develop skills outside your comfort zone, and encourage others to do the same.Effectively mentor others.Use the review of work as an opportunity to deepen the expertise of team members.Address conflicts or issues, engaging in difficult conversations with clients, team members and other stakeholders, escalating where appropriate.Uphold and reinforce professional and technical standards (e.g. refer to specific PwC tax and audit guidance), the Firm's code of conduct, and independence requirements.

Minimum Degree Required

Bachelor's Degree

Required Field(s) Of Study

Management Information Systems, Computer and Information Science, Systems Engineering,Electrical Engineering,Chemical Engineering,Industrial Engineering,Mathematics,Statistics,Mathematical Statistics

Minimum Year(s) Of Experience

5 year(s)

Preferred Qualifications

Demonstrates abilities and/or success in one or many of the following areas:

Design and implement comprehensive data architecture strategies that meet the current and future business needs; Develop and document data models, data flow diagrams, and data architecture guidelines; Ensure data architecture is compliant with data governance and data security policies; Collaborate with business stakeholders to understand their data requirements and translate them into technical solutions; Evaluate and recommend new data technologies and tools to enhance data architecture; Build, maintain, and optimize ETL/ELT pipelines for data ingestion, processing, and storage across batch and real-time data processing; Build, maintain, and optimize Data Quality rules leveraging DQ tools and/or other ETL/ELT tools; Develop and deploy scalable data storage solutions using AWS, Azure and GCP services such as S3, Redshift, RDS, DynamoDB, Azure Data Lake Storage, Azure Cosmos DB, Azure SQL DB, GCP Cloud Storage etc.; Implement data integration solutions using AWS Glue, AWS Lambda, Azure Data Factory, Azure Functions, GCP Functions, GCP Dataproc, Dataflow and other relevant services; Design and manage data warehouses and data lakes, ensuring data is organized and accessible; Monitor and troubleshoot data pipelines, data warehouses and workflows to ensure data quality, system reliability, performance and cost management; Implement IAM roles and policies to manage access and permissions within AWS, Azure, GCP; Use AWS CloudFormation, Azure Resource Manager templates, Terraform for infrastructure as code (IaC) deployments; Use AWS, Azure and GCP DevOps services to build and deploy DevOps pipelines; Implement data security best practices using AWS, Azure, GCP, Snowflake or Databricks; Optimize Cloud resources for cost, performance, and scalability; Strong proficiency in SQL and experience with relational databases; Proficient in programming languages such as Python, Java, or Scala; Familiarity with big data technologies like Hadoop, Spark, or Kafka is a plus; Experience with machine learning and data science workflows is a plus; Knowledge of data governance and data security best practices; Strong analytical, problem-solving, and communication skill; and, Ability to work independently and as part of a team in a fast-paced environment. 

Demonstrates thought leader-level abilities with, and/or a proven record of success directing efforts in the following areas:

Applying modern, cloud-based technology skills, ability to research emerging trends, analyst publications, and adoption of modern technologies in solution architectures; Collaborating and contributing as a team member: understanding personal and team roles, contributing to a positive working environment by building proven relationships with team members, proactively seeking guidance, clarification and feedback; Prioritizing and handling multiple tasks, researching and analyzing pertinent client, industry and technical matters, utilizing problem-solving skills, and communicating effectively in written and verbal formats to various audiences (including various levels of management and external clients) in a professional business environment; and, Coaching and collaborating with associates who assist with this work, including providing coaching, feedback and guidance on work performance. 

Learn more about how we work: https://pwc.to/how-we-work

PwC does not intend to hire experienced or entry level job seekers who will need, now or in the future, PwC sponsorship through the H-1B lottery, except as set forth within the following policy: https://pwc.to/H-1B-Lottery-Policy.

As PwC is an equal opportunity employer, all qualified applicants will receive consideration for employment at PwC without regard to race; color; religion; national origin; sex (including pregnancy, sexual orientation, and gender identity); age; disability; genetic information (including family medical history); veteran, marital, or citizenship status; or, any other status protected by law. 

For only those qualified applicants that are impacted by the Los Angeles County Fair Chance Ordinance for Employers, the Los Angeles' Fair Chance Initiative for Hiring Ordinance, the San Francisco Fair Chance Ordinance, San Diego County Fair Chance Ordinance, and the California Fair Chance Act, where applicable, arrest or conviction records will be considered for Employment in accordance with these laws. At PwC, we recognize that conviction records may have a direct, adverse, and negative relationship to responsibilities such as accessing sensitive company or customer information, handling proprietary assets, or collaborating closely with team members. We evaluate these factors thoughtfully to establish a secure and trusted workplace for all.

Applications will be accepted until the position is filled or the posting is removed, unless otherwise set forth on the following webpage. Please visit this link for information about anticipated application deadlines: https://pwc.to/us-application-deadlines

The salary range for this position is: $99,000 - $232,000, plus individuals may be eligible for an annual discretionary bonus. For roles that are based in Maryland, this is the listed salary range for this position. Actual compensation within the range will be dependent upon the individual's skills, experience, qualifications and location, and applicable employment laws. PwC offers a wide range of benefits, including medical, dental, vision, 401k, holiday pay, vacation, personal and family sick leave, and more. To view our benefits at a glance, please visit the following link: https://pwc.to/benefits-at-a-glance

",https://ad.doubleclick.net/ddm/clk/438405794;254302458;m?https://jobs.us.pwc.com/job/-/-/932/81216676944?utm_source=linkedin.com&utm_campaign=core_media&utm_medium=social_media&utm_content=job_posting&ss=paid,6
13,iHire,https://www.linkedin.com/company/ihire-llc/life,Machine Learning Engineer,https://www.linkedin.com/jobs/view/4259189813,4259189813,"Dallas, TX",Remote,,2025-07-02 13:28:19,False,,"Capital One has partnered with iHire to reach top talent for their opening below. Check it out and apply via iHireTechnology today!

Lead Machine Learning Engineer, Shopping - Feed (Remote)

Interested in joining a dynamic remote first engineering team in a fast-paced environment full of greenfield problem-solving? Then Capital One Shopping might be the place for you. Join us in supporting a growth-stage line of business with a startup mindset as we build technology to save our customers money.

As a Capital One Machine Learning Engineer (MLE), you'll be part of a fast moving, highly collaborative Agile team dedicated to productionizing machine learning applications and systems at scale. Youll drive and deliver the detailed technical designs, development, and implementation of machine learning applications using existing and emerging technology platforms. Youll be a leader of machine learning architectural design, develop and review model and application code, and ensure high availability and performance of our machine learning applications. You'll contribute to researching our next generation of models and recommendation systems to deliver value to our customers. Youll mentor junior developers and serve as a technical bridge between product partners. You will use tools like Docker, Nomad, SQL, Python, Pytorch, Transformers, language models, and other statistical tools.

This is more than just a job; it's an opportunity to be part of a collaborative and forward-thinking community, where your contributions will make a significant impact in an ever-dynamic tech landscape. Join us as we push boundaries and redefine the future of our industry.

What Youll Do In The Role

 The MLE role overlaps with many disciplines, such as Ops, Modeling, and Data Engineering. In this role, you'll be expected to perform many ML engineering activities, including one or more of the following:  Design, build, and/or deliver ML models and components that solve real-world business problems, while working in collaboration with the Product and Data Science teams.  Inform your ML infrastructure decisions using your understanding of ML modeling techniques and issues, including choice of model, data, and feature selection, model training, hyperparameter tuning, dimensionality, bias/variance, and validation).  Solve complex problems by writing and testing application code, developing and validating ML models, and automating tests and deployment.  Collaborate as part of a cross-functional Agile team to create and enhance software that enables state-of-the-art big data and ML applications.  Retrain, maintain, and monitor models in production.  Leverage or build cloud-based architectures, technologies, and/or platforms to deliver optimized ML models at scale.  Construct optimized data pipelines to feed ML models.  Leverage continuous integration and continuous deployment best practices, including test automation and monitoring, to ensure successful deployment of ML models and application code.  Ensure all code is well-managed to reduce vulnerabilities, models are well-governed from a risk perspective, and the ML follows best practices in Responsible and Explainable AI.  Use programming languages like Python, Scala, or Java.  Design and research new models using data scientist experience/expertise 

Basic Qualifications

 Bachelors degree  At least 6 years of experience designing and building data-intensive solutions using distributed computing (Internship experience does not apply)  At least 4 years of experience programming with Python, Scala, or Java  At least 2 years of experience building, scaling, and optimizing ML systems 

Preferred Qualifications

 Master's or doctoral degree in computer science, electrical engineering, mathematics, or a similar field  3+ years of experience building production-ready data pipelines that feed ML models  3+ years of on-the-job experience with an industry recognized ML framework such as scikit-learn, PyTorch, Dask, Spark, or TensorFlow  2+ years of experience developing performant, resilient, and maintainable code  2+ years of experience with data gathering and preparation for ML models 

At this time, Capital One will not sponsor a new applicant for employment authorization, or offer any immigration related support for this position (i.e. H1B, F-1 OPT, F-1 STEM OPT, F-1 CPT, J-1, TN, or another type of work authorization).

The minimum and maximum full-time annual salaries for this role are listed below, by location. Please note that this salary information is solely for candidates hired to perform work within one of these locations, and refers to the amount Capital One is willing to pay at the time of this posting. Salaries for part-time roles will be prorated based upon the agreed upon number of hours to be regularly worked.

Remote (Regardless of Location): $175,800 - $200,700 for Lead Machine Learning EngineerRichmond, VA: $175,800 - $200,700 for Lead Machine Learning Engineer

Candidates hired to work in other locations will be subject to the pay range associated with that location, and the actual annualized salary amount offered to any candidate at the time of hire will be reflected solely in the candidates offer letter.

This role is also eligible to earn performance based incentive compensation, which may include cash bonus(es) and/or long term incentives (LTI). Incentives could be discretionary or non discretionary depending on the plan.

Capital One offers a comprehensive, competitive, and inclusive set of health, financial and other benefits that support your total well-being. Learn more at the Capital One Careers website . Eligibility varies based on full or part-time status, exempt or non-exempt status, and management level.

This role is expected to accept applications for a minimum of 5 business days.No agencies please. Capital One is an equal opportunity employer (EOE, including disability/vet) committed to non-discrimination in compliance with applicable federal, state, and local laws. Capital One promotes a drug-free workplace. Capital One will consider for employment qualified applicants with a criminal history in a manner consistent with the requirements of applicable laws regarding criminal background inquiries, including, to the extent applicable, Article 23-A of the New York Correction Law; San Francisco, California Police Code Article 49, Sections 4901-4920; New York Citys Fair Chance Act; Philadelphias Fair Criminal Records Screening Act; and other applicable federal, state, and local laws and regulations regarding criminal background inquiries.

If you have visited our website in search of information on employment opportunities or to apply for a position, and you require an accommodation, please contact Capital One Recruiting at [phone removed] or via email at [email removed] . All information you provide will be kept confidential and will be used only to the extent required to provide needed reasonable accommodations.

For technical support or questions about Capital One's recruiting process, please send an email to [email removed]

Capital One does not provide, endorse nor guarantee and is not liable for third-party products, services, educational tools or other information available through this site.

Capital One Financial is made up of several different entities. Please note that any position posted in Canada is for Capital One Canada, any position posted in the United Kingdom is for Capital One Europe and any position posted in the Philippines is for Capital One Philippines Service Corp. (COPSSC).

",https://www.ihiretechnology.com/ppc/dp/24/483539033?utm_campaign=programmatic&utm_medium=downpost&utm_term=2025-07-02&utm_content=&utm_source=linkedin&ih_linkedinjobtype=slot&ih_date=2025-07-02,6
53,Lensa,https://www.linkedin.com/company/lensa/life,"Data Engineer, Amazon Pharmacy",https://www.linkedin.com/jobs/view/4260849088,4260849088,"Seattle, WA",On-site,$118.9K/yr - $205.6K/yr,2025-07-02 14:08:35,False,,"Lensa is a career site that helps job seekers find great jobs in the US. We are not a staffing firm or agency. Lensa does not hire directly for these jobs, but promotes jobs on LinkedIn on behalf of its direct clients, recruitment ad agencies, and marketing partners. Lensa partners with DirectEmployers to promote this job for Amazon.

Description

Innovation is at the core of what we do. We believe that by removing and reducing the barriers that prevent people from taking their medications, we can help customers conveniently get the medications they need, when they need them and take them as prescribed.

We have provided customers with the ability to find transparent and simple pricing, receive 24/7 customer service support, and have their meds delivered to their doorsteps while creating programs and products that embody our mission and position ourselves in becoming the world’s safest and fastest online pharmacy.

We are looking for a Data Engineer to join us on our journey to make it drastically easier for customers to find, choose, afford, and engage with the services, products, and professionals they need to get and stay healthy!

As a Data Engineer in Pharmacy team, you will partner with Software Engineers, Business Intelligence Engineers and product managers. You will design, implement, and maintain next generation BI solutions for large scale, highly secure and complex data structures to ensure the data is auditable, available and accessible. You will gain a deep understanding of our services and the data they produce, and become our resident expert in how to transform that data into a format that is useful for analytics and business intelligence. You will proactively help to identify new data for integration with our platform, and propose and implement new technologies to help us better understand our data.

Key job responsibilities

 Design, implement, maintain and support a secure and robust data lake in native AWS with 300+ datasets which contain both PII and PHI data. Implement ingestion routines both real time and batch using best practices in modeling, ETL/ELT processes by leveraging AWS technologies and big data tools. Interface with other technology teams to extract, transform, and load data from a wide variety of data sources using SQL, Python and AWS big data technologies. Gather business and functional requirements and translate into secure, robust, scalable,

operable solutions with a flexible and adaptable architecture.

 Collaborate with engineers to help adopt best practices in system creation, integrity, test design, analysis, validation, and documentation. Help continually improve ongoing reporting and analysis processes, automating or simplifying

self-service tools for customers.

 Explore and learn the latest AWS technologies to provide new capabilities and increase

efficiency

Basic Qualifications

3+ years of data engineering experience Experience with data modeling, warehousing and building ETL pipelines Bachelor's degree 3+ years of analyzing and interpreting data with Redshift, Oracle, NoSQL etc. experience Experience with big data technologies such as: Hadoop, Hive, Spark, EMR Experience working on and delivering end to end projects independently 

Preferred Qualifications

Experience with AWS technologies like Redshift, S3, AWS Glue, EMR, Kinesis, FireHose, Lambda, and IAM roles and permissions Experience with non-relational databases / data stores (object storage, document or key-value stores, graph databases, column-family databases) Experience building large-scale, high-throughput, 24x7 data systems Experience providing technical leadership and mentoring other engineers for best practices on data engineering Experience working with secure medical data, pipeline, services and HIPAA compliant environment 

Amazon is an equal opportunity employer and does not discriminate on the basis of protected veteran status, disability, or other legally protected status.

Our inclusive culture empowers Amazonians to deliver the best results for our customers. If you have a disability and need a workplace accommodation or adjustment during the application and hiring process, including support for the interview or onboarding process, please visit https://amazon.jobs/content/en/how-we-hire/accommodations for more information. If the country/region you’re applying in isn’t listed, please contact your Recruiting Partner.

Our compensation reflects the cost of labor across several US geographic markets. The base pay for this position ranges from $118,900/year in our lowest geographic market up to $205,600/year in our highest geographic market. Pay is based on a number of factors including market location and may vary depending on job-related knowledge, skills, and experience. Amazon is a total compensation company. Dependent on the position offered, equity, sign-on payments, and other forms of compensation may be provided as part of a total compensation package, in addition to a full range of medical, financial, and/or other benefits. For more information, please visit https://www.aboutamazon.com/workplace/employee-benefits . This position will remain posted until filled. Applicants should apply via our internal or external career site.

If you have questions about this posting, please contact support@lensa.com",https://lensa.com/cgw/4394ea22965d4bb9976072a12fb5060ftjo1?jpsi=directemployers&publisher_preference=easier_apply&utm_campaign=Computer%20Occupations&utm_medium=slot&utm_source=linkedin&utm_term=jse,6
