,company,company_url,job_title,job_url,job_id,location,work_type,salary,posted_at,is_easy_apply,applicant_count,description,apply_url,posted_ago
83,TalentAlly,https://www.linkedin.com/company/talentallyatwork/life,"Data Engineer 3- Scala - Chicago, IL or Reston, VA- ONSITE (4 days a week)",https://www.linkedin.com/jobs/view/4261002091,4261002091,Greater Chicago Area,Hybrid,$100.1K/yr - $150.2K/yr,2025-07-02 17:59:42,False,,"FreeWheel, a Comcast company, provides comprehensive ad platforms for publishers, advertisers, and media buyers. Powered by premium video content, robust data, and advanced technology, we're making it easier for buyers and sellers to transact across all screens, data types, and sales channels. As a global company, we have offices in nine countries and can insert advertisements around the world.Job SummaryWe are seeking a Data Engineer to design, build, and optimize scalable, high-performance data pipelines. The ideal candidate will have expertise in big data processing frameworks, data storage technologies, and monitoring platforms while thriving in a collaborative, fast-moving environment. If you are a problem solver, a mentor, and someone who enjoys pushing the boundaries of data engineering, this is the opportunity for you!Job DescriptionCore Responsibilities:Own the complete software development lifecycle-from design to deployment-of scalable batch and streaming data pipelines to ingest and transform large datasets from various sources.Optimize streaming and batch data processing to ensure performance, scalability, and cost efficiency.Monitor system performance, troubleshoot issues, and implement solutions to ensure high availability and reliability.Maintain and enhance FreeWheel's internal monitoring platform, ensuring comprehensive observability and operational excellence for the entire Streaming Hub and Audience Platform.Collaborate with product managers and stakeholders to understand data requirements and deliver solutions that drive business impact.Effectively communicate technical concepts to non-technical stakeholders.Stay ahead of emerging data engineering technologies and best practices, identifying opportunities to improve processes, tools, and infrastructure.Document data pipelines, processes, and systems to ensure clarity and maintainability.Mentor and guide junior data engineers, fostering a culture of learning, collaboration, and technical excellence.Consistent exercise of independent judgment and discretion in matters of significance.Regular, consistent and punctual attendance. Must be able to work nights and weekends, variable schedule(s) as necessary.Other duties and responsibilities as assigned.
Qualifications:Bachelor's or master's degree in computer science, Engineering, or a related field.2+ years of experience in building and operating large-scale data processing systems.Proficiency in multiple programming languages, including Scala, Java, Python, and SQL.Familiarity with big data processing frameworks, such as Apache Flink, Apache Spark (Batch & Streaming), and Databricks Delta Live Tables (DLT).Understanding of data storage technologies, including AWS S3, Delta Lake, Apache Iceberg, Hadoop HDFS, and Apache Druid.Basic understanding of Data Lakehouse architectures, data modeling techniques, ETL processes, and relational databases (e.g., MySQL).Experience with AWS services, such as Glue, EMR and Lambda.Experience with workflow orchestration tools, such as Apache Airflow and Azkaban.Knowledge of NoSQL databases, including HBase.Strong problem-solving skills with a keen attention to detail.Excellent communication and collaboration skills to work effectively with technical and non-technical teams.Ability to quickly adapt and context switch among different priorities, working efficiently in a fast-paced environment.Strong generalist mindset with the ability to work across different technology stacks and polyglot programming skills, demonstrating fluency in multiple programming languages beyond primary expertise.Nice to Have:Experience managing highly scalable data infrastructures, ensuring performance, reliability, and cost-efficiency.Experience in modeling and processing complex, hierarchical data structures such as Ad Logs.Adept in planning work for self and the team while collaborating closely with product stakeholders.


Employees at all levels are expected to:Understand our Operating Principles; make them the guidelines for how you do your job.Own the customer experience - think and act in ways that put our customers first, give them seamless digital options at every touchpoint, and make them promoters of our products and services.Know your stuff - be enthusiastic learners, users and advocates of our game-changing technology, products and services, especially our digital tools and experiences.Win as a team - make big things happen by working together and being open to new ideas.Be an active part of the Net Promoter System - a way of working that brings more employee and customer feedback into the company - by joining huddles, making call backs and helping us elevate opportunities to do better for our customers.Drive results and growth.Respect and promote inclusion & diversity.Do what's right for each other, our customers, investors and our communities.
Why Join FreeWheel?Cutting-Edge Technology: Work with modern data stacks, cloud platforms, and real-time processing frameworks.Innovation-Driven Culture: Collaborate with top engineers, data scientists, and industry leaders shaping the future of ad tech.Growth & Impact: Solve complex, large-scale data challenges with tens of billions of daily events in a high-impact role.Flexible & Inclusive Work Environment: We value diverse perspectives, work-life balance, and professional development.
About FreeWheelFreeWheel, a Comcast company, is a global leader in advanced advertising technology, enabling seamless transactions across screens, data types, and sales channels. Operating in nine countries, FreeWheel powers global ad insertion and recently launched Universal Ads, a cross-publisher TV advertising platform in collaboration with major media players like NBCUniversal, Warner Bros. Discovery, and Roku. Committed to innovation, inclusivity, and professional growth, FreeWheel fosters a dynamic work environment where diverse perspectives thrive while shaping the future of premium video advertising.
About the FreeWheel Data TeamThe FreeWheel Data Team is a global, high-impact engineering team focused on building scalable, high-performance, efficient data platforms and rich analytic user experiences. We develop solutions to ingest, transform, organize, and distribute vast volumes of advertising and audience data, enabling a Unified Data Lake and Data Warehouse that powers customer-facing products, machine learning applications, and real-time analytics. We process tens of billions of ad events daily, leveraging a modern data stack that includes Databricks, AWS, Apache Spark, ClickHouse, Snowflake, and Google Looker.
Disclaimer:This information has been designed to indicate the general nature and level of work performed by employees in this role. It is not designed to contain or be interpreted as a comprehensive inventory of all duties, responsibilities and qualifications.
Comcast is proud to be an equal opportunity workplace. We will consider all qualified applicants for employment without regard to race, color, religion, age, sex, sexual orientation, gender identity, national origin, disability, veteran status, genetic information, or any other basis protected by applicable law.Skills:Data Engineering; Structured Query Language (SQL); Python (Programming Language)
Salary:Primary Location Pay Range: $100,118.14 - $150,177.21Comcast intends to offer the selected candidate base pay within this range, dependent on job-related, non-discriminatory factors such as experience. The application window is 30 days from the date job is posted, unless the number of applicants requires it to close sooner or later.

Base pay is one part of the Total Rewards that Comcast provides to compensate and recognize employees for their work. Most sales positions are eligible for a Commission under the terms of an applicable plan, while most non-sales positions are eligible for a Bonus. Additionally, Comcast provides best-in-class Benefits to eligible employees. We believe that benefits should connect you to the support you need when it matters most, and should help you care for those who matter most. That's why we provide an array of options, expert guidance and always-on tools, that are personalized to meet the needs of your reality - to help support you physically, financially and emotionally through the big milestones and in your everyday life. Please visit the compensation and benefits summary on our careers site for more details.
EducationBachelor's DegreeWhile possessing the stated degree is preferred, Comcast also may consider applicants who hold some combination of coursework and experience, or who have extensive related professional experience.Relevant Work Experience5-7 YearsPDN-9f4a6e3a-5cb6-46d0-b9c1-bfe079f508c1",https://www.adzuna.com/land/ad/5278448217?v=135BDCD0C598C276321E7DF4A1FF0417A01962DD&r=19707339&frd=c4f60cf300a8319d9d1c1d583235a505&ccd=393bf47e34f3d2e105505622394965b9&utm_source=talentally-dynamic&utm_medium=ppc&partnerb=1&chnlid=3864&title=Data%20Engineer%203-%20Scala%20-%20Chicago%2C%20IL%20or%20Reston%2C%20VA-%20ONSITE%20%284%20days%20a%20week%29&a=e&utm_content=1&utm_campaign=0.12,5
82,Harvey Nash,https://www.linkedin.com/company/harvey-nash/life,Data Movement Engineer (Talend),https://www.linkedin.com/jobs/view/4259580605,4259580605,"New Haven, CT",Remote,$55/hr - $60/hr,2025-07-02 19:31:14,True,35 applicants,"""US citizens and Green Card Holders and those authorized to work in the US are encouraged to apply. We are unable to sponsor H1b candidates at this time”

Title: Data Movement Engineer (Talend) 
Type: Long Term Contract
Location: New Haven, CT (100% Remote)

Overview:The client is embarking on the modernization of its core data platforms, currently seeking a Data Movement Engineer who can assist with modernizing client's current ETL environment, as well as begin building new ETL/ELT workflows and data pipelines as they move towards a cloud environment. The Data Movement Engineer will support data architects, data analysts, and business intelligence developers on various data initiatives. They must be self-directed and comfortable supporting the data requirements of multiple teams and systems. The ideal candidate will also possess experience in the data management domain and be willing to contribute their technical skills and experience towards the development of elegant and efficient data processes and systems.

Core Responsibilities:Complete full life cycle of ETL/ELT development to address business needs or resolve issues including design, mappings, data transformations, scheduling and testing.Translate data movement requirements into technical designs.Develop ETL/ELT workflows, mappings, and data pipelines to extract, transform, and load data into target environments.Develop data extraction and transmissions to external vendors.Develop test plans and perform unit testing.Create supporting documentation for new processes.Work closely with data analysts to gain understanding of business processes and corporate data.Determine impacts to data warehouse structures and information flows due to changes in business or technical requirements.Contribute to architectural decisions to support business processes.Provide production support for data solutions.Complete root cause analysis and contribute to remediation planning and implementation.Perform data quality analysis, report data quality issues and propose solutions for data quality management.Learn and expand upon internal controls and participate in customer support.Prepare effort estimation including researching and estimating costs of software development, unit testing. May provide estimates for upgrades of vendor packages upgrades and integration with existing systems.On Call and/or after hours work required.Other related duties as directed.

Skills QualificationsRequired:Minimum of 5 years of relevant experience in data warehousing, business intelligence tools, and the analysis of dataMinimum of 3 years of SQL query development, preferably in multiple database management platforms, and working with normalized relational databases and dimensional data warehouse implementationsProficiency in ETL/ELT concepts and tools (Informatica IICS and PowerCenter preferred)Some experience with cloud-based database technologies requiredWorking knowledge of data warehousing concepts, structures and ETL best practicesExperience using query tools (e.g. AQT, MS Query)Ability to problem solve using analytical thinking skillsMust work well independently - must be inquisitive and seek answers to complex questions without being promptedStrong organizational and time management skillsStrong communication skills including verbal and written to communicate effectively with clients and managementStrong project management skills to ensure that projects get done on time and within budgetEffectively participates in teams and moves the team toward completion of goals Preferred:Some experience with data visualization tools (e.g. Tableau) desirable
EducationRequired:BA or BS in Computer Science, Information Systems or related field5+ years' experience
A reasonable, good faith estimate of the $55/hr to $60/hr W2 for this position.",https://www.linkedin.com/jobs/view/4259580605,5
80,Photon,https://www.linkedin.com/company/photon-interactive/life,Python Developer,https://www.linkedin.com/jobs/view/4259581513,4259581513,"Dallas, TX",On-site,,2025-07-02 19:32:58,True,14 applicants,"Greetings from Photon!!
Who are we?Photon has emerged as one of the world’s largest and fastest-growing Digital Agencies. We work with 40% of the Fortune 100 on their Digital initiatives and are known for our ability to integrate Strategy Consulting, Creative Design, and Technology at scale. For a brief 1 minute video about us, you can check https://youtu.be/uJWBWQZEA6o.
Python DeveloperLocation : Dallas, TX (Onsite)Hiring Type : Full Time
We are looking for a Python Developer with a diverse skill set. The successful candidate will have a strong background in Python development, with experience in designing, implementing, and delivering high-quality software solutions. The primary focus will be on developing applications for acquiring, storing, and calculating on large volumes of data using mathematical formulas.Responsibilities:Design, develop, and implement complex Python data computation applications.Lead the design and implementation of key features and components of our product suite.Collaborate with cross-functional teams to define, design, and deliver new features.Ensure code quality, adherence to coding standards, and maintainability through linting and automated testing.Mentor junior developers, conduct code reviews, and ensure software deliverables meet high-quality standards.Troubleshoot and resolve software defects and other technical issues.Qualifications:Proven 9+ Years of experience as a Senior Python Developer primarily backend applicationsStrong knowledge of Python and familiarity with various Python libraries and frameworks such as Pandas, NumPy, Flask, Django, Fast APIUnderstanding of code quality, DevSecOps, and automated testing.Excellent problem-solving skills and attention to detail.Strong communication skills and the ability to work as part of a team.Experience in leading a team or mentoring junior developers is a plus.Preferred Qualifications:Familiarity with Agile development methodologies.Experience with cloud platforms like AWS, Google Cloud, or Azure.Experience with Docker or other containerization technologies.Experience Analytical platforms like SnowflakeExperience with financial services data",https://www.linkedin.com/jobs/view/4259581513,5
76,Cygnus Professionals Inc.,https://www.linkedin.com/company/cygnus-professionals-inc-/life,Data Architect and Data Architect (Not Data Engineer),https://www.linkedin.com/jobs/view/4261014333,4261014333,"Reading, PA",Hybrid,,2025-07-02 19:10:33,True,28 applicants,"Must have: On Prem to AWS migration.Must have: On Prem to AWS migration • 14+ years of experience in IT• 12+ years of Data Engineering, Data Modeling, Data Warehousing, Master Data Management, Reference Data Management, Data Lineage, Data Governance and Meta Data Management experience required• 10+ years of experience in defining Data & Analytics architecture implementing multiple large volume projects across on Prem and on cloud environments. Preferably AWS cloud.• 7+ years of experience collaborating with Agile teams preferred• Expertise in designing, validating, and implementing multiple projects across the hybrid infrastructure (On-cloud to On-Premises and vice versa)• Expertise in setting up Data Lakes and analytical environments• Expertise with Data Engineering/Big data tools such as Python, PySpark, Kafka, API’s, Talend and BODS, etc.• Expertise with relational SQL and NoSQL databases• Experience in building data pipelines, data ingestions, data integrations, data preparations, and traditional Data warehouses and Datamarts• Experience in building processes supporting data transformation, data structures, metadata, dependency, and workload management• Strong experience with data modelling techniques utilizing tools such as Erwin, ER Studio etc.• Experience with visualization tools such as QlikView, Qlik Sense, Tableau, etc.• Experience in message queuing, stream processing, and highly scalable ‘big data’ data stores• Meet with Senior & Mid-Level Management to align business process initiatives and strategies with current and planned Penske Data Engineering & Analytics Architecture• Evaluate Data Engineering & Analytics Tools/Techniques/ Approaches and determine impact on strategic objectives and manage overall implementation• Be the primary contact and technical lead for multiple critical programs and integrations and resolve customer issues in a timely man

About Cygnus Professionals, Inc.Cygnus is a Princeton, NJ-headquartered global Business IT consulting and software Services firm with offices in the USA and Asia. Cygnus offers and enables innovation and helps our clients accelerate time to market & grow their business. Over 15 years, we have taken great pride in continuing our deep relationships with our clients. 
Cygnus Belief We believe in our commitment to diversity & inclusion. 
Equal Employment Opportunity Statement Cygnus is an Equal Opportunity Employer. We ensure that no one should be discriminated against because of their differences, such as age, disability, ethnicity, gender, gender identity and expression, religion, or sexual orientation. 
All our employment decisions are taken without looking into age, race, creed, color, religion, sex, nationality, disability status, sexual orientation, gender identity or expression, genetic information, marital status, citizenship status, or any other aspects of employment protected by federal, state, or local law. Applicants for employment in the US must have valid work authorization.",https://www.linkedin.com/jobs/view/4261014333,5
75,Enigma,https://www.linkedin.com/company/enigma-rec/life,"Senior AI Engineer | NLP | Large Language Models | Machine Learning | Remote, US",https://www.linkedin.com/jobs/view/4259582519,4259582519,United States,Remote,,2025-07-02 19:41:52,True,3 applicants,"Senior AI Engineer | NLP | Large Language Models | Machine Learning | Remote, US
We are looking for multiple Senior AI Engineer, they are responsible for building AI and machine learning models and pipelines, with a particular emphasis on generative AI, large language models (LLMs), and predictive modeling. This role involves collaborating closely with business and product stakeholders to understand data requirements and product specifications, enabling data-driven decision-making and product design. Additionally, the position requires coordination with software engineers and developers to deliver effective solutions.
A key aspect of the role involves rapidly acquiring new tools and technologies, leveraging a strong foundation in machine learning and artificial intelligence alongside basic programming and scripting skills. The individual in this position is expected to have practical experience in the design, development, management, and maintenance of systems as well as in handling large datasets. Expertise with commonly used AI and machine learning frameworks and a solid grasp of fundamental techniques—including deep learning, regression, classification, and clustering algorithms—are essential. Familiarity with retrieval-augmented generation pipelines and designing LLM-supported use cases is also critical.
ResponsibilitiesLeading AI strategy by delivering integrated solutions that combine software engineering, statistics, and machine learning for complex clinical applications.Executing rigorous, analytical experiments to achieve incremental improvements using the most suitable techniques.Preparing comprehensive reports and presentations to convey hypotheses and insights that support organizational decision-making.Becoming the subject matter expert on available organizational data by identifying, collecting, transforming, and exploring datasets.Facilitating seamless collaboration between engineers, product analysts, and other teams within the organization.
Experience5 to 7 years of relevant experience.Leadership experience is advantageous.At least three years of experience in an AI Engineer role.Advanced degree (Ph.D. or MSc) in computer science, machine learning, AI, or related fields, or equivalent experience in designing, building, and evaluating machine learning systems.Proficiency with machine learning ecosystem tools such as PyTorch, TensorFlow, Scikit-learn, and XGBoost.Strong statistical analysis and machine learning knowledge, with practical programming skills (e.g., Python, R, SQL).Expertise in data visualization, model implementation, testing, and deployment.Experience evaluating and working with LLM-based pipelines, including retrieval-augmented generation and prompting techniques, is advantageous.Familiarity with tools like LangChain, LlamaIndex, Haystack, Azure AI Studio, vector databases, or equivalent LLM-enabled technologies.Proficiency in database access and management using SQL, Azure Data Factory, or similar technologies.Familiarity with big data frameworks (e.g., Hadoop, Spark) or equivalent systems.Understanding of MLOps principles, including orchestration tools, cloud computing, and observability platforms.
💰Up to $200,000 USD + Bonus📍Fully remote anywhere in the US
If you are interested in finding out more about this hire please reach out to jason@enigma-rec.ai for immediate consideration.
Senior AI Engineer | NLP | Large Language Models | Machine Learning | Remote, US",https://www.linkedin.com/jobs/view/4259582519,5
